SID,P_Pref,C_Pref ,Cl_Support,Tr_Support,Cand_Support,Rep_Prim,Dem_Prim,PrimElect,Tr_Dona,Tr_Volu,Cl_Dona,Cl_Volu,Cand_Dona,Cand_Volu,prev_candSupport,Tr_Difi_Dist,Tr_Difi_Over,Cl_Difi_Dist,Cl_Difi_Over,Cand_Difi_Dist,Cand_Difi_Overlap,Dem_Iden,Rep_Iden,Party_Iden,Regi,Reg_Party,Reg_Party_Plan,Dem_Dona,Dem_Volu,Rep_Dona,Rep_Volu,Party_Dona,Party_Volu,prev_partySupport,Rep_Difi_Dist,Rep_Difi_Over,Dem_Difi_Dist,Dem_Difi_Over,Party_Difi_Dist,Party_Difi_Over,DG_Test1,DG_Test2,DG_Test3,DG_Choice,Expl,Tr_Happy,Cl_Happy,EarlyVote,candVote_Choice,ClintonSupporter_Happy,TrumpSupporter_Happy,OtherSupporter_Happy,Gender,Age,Education,Income,USCit,Surveys,SimSurv,Scept,Wave,DG_In
799,Republican,Trump,,7,7,Trump,,Yes,No,No,,,No,No,0,125,100,,,125,100,,7,7,Yes,Rep,,,,No,No,No,No,0,96,98,,,96,98,40,0,20,0,"He would do the same to me. Look, we are rational creatures, as Trump supporters. Not flightly cum-by-yah Democrats that think we are all in some big giant spaceship and have to work together in order to survive. Takes a village to raise a kid my ass! We are in it for ourselves and our immediate family Trump supporters know this and act accordingly. It's only honest.",7,1,No,,,,,Male,46,Grad,"$50,001-$65,000",Yes,3700,2,5,3,yes
800,Democrat,Clinton,7,,7,,Clinton,Yes,,,No,Yes,No,Yes,1,,,29,20,29,20,6,,6,Yes,Dem,,No,Yes,,,No,Yes,1,,,8,3,8,3,40,0,20,0,I want to make as much $ as possible,1,7,No,,,,,Female,27,Coll,"$15,001-$25,000",Yes,500,3,5,3,yes
801,Democrat,Clinton,5,,5,,Sanders,Yes,,,No,No,No,No,0,,,41,32,41,32,4,,4,Yes,Dem,,Yes,No,,,Yes,No,1,,,68,65,68,65,40,40,20,20,I want to support people who support similar political ideals as I do.,1,6,No,,,,,Female,33,Coll,"$15,001-$25,000",Yes,250,2,3,3,no
802,Republican,Trump,,5,5,Trump,,Yes,No,No,,,No,No,0,50,43,,,50,43,,6,6,Yes,Rep,,,,No,No,No,No,0,97,98,,,97,98,40,0,40,40,"I decided to transfer 40 cents, because I want to believe that people are inherently good and the other person will also transfer the 40 cents so we each get an equal bonus for our work",6,1,Yes,,,,,Female,29,Coll,"$50,001-$65,000",Yes,15,4,4,3,no
803,Republican,Trump,,1,1,Other,,No,No,No,,,No,No,0,-100,0,,,-100,0,,1,1,Yes,Other,,,,No,No,No,No,0,-100,0,,,-100,0,40,0,20,20,It seemed like the most fair thing to do.,2,1,No,,,,,Female,28,<Coll,"$15,001-$25,000",Yes,1000,3,1,3,yes
804,Republican,Trump,,6,6,Trump,,No,No,No,,,No,No,0,19,11,,,19,11,,4,4,Yes,Other,,,,No,No,No,No,0,19,11,,,19,11,40,0,20,20,"It seemed like the most fair and equal split of the bonus money, assuming we are both doing the same 'work'.",6,1,No,,,,,Female,50,Coll,"$50,001-$65,000",Yes,5000,2,3,3,yes
805,Republican,Trump,,6,6,Trump,,No,No,No,,,No,No,0,17,9,,,17,9,,5,5,Yes,Other,,,,Yes,No,Yes,No,1,29,20,,,29,20,40,0,0,10,,,,,,,,,,,,,,,,,3,no
806,Democrat,Clinton,3,,3,,Sanders,Yes,,,No,No,No,No,0,,,11,4,11,4,4,,4,Yes,Dem,,No,No,,,No,No,0,,,7,2,7,2,40,0,20,0,I need the money.,1,3,No,,,,,Male,25,HS,"$25,001-$35,000",Yes,1111,1,3,3,yes
807,Democrat,Clinton,5,,5,,Clinton,Yes,,,No,Yes,No,Yes,1,,,-49,0,-49,0,6,,6,Yes,Dem,,No,Yes,,,No,Yes,1,,,-49,0,-49,0,40,0,20,0,I need the money,1,5,Yes,,,,,Male,29,HS,"$25,001-$35,000",Yes,70,4,2,3,yes
808,Republican,Trump,,7,7,Trump,,Yes,No,No,,,No,No,0,66,63,,,66,63,,2,2,No,,Yes-Rep,,,No,No,No,No,0,29,19,,,29,19,40,0,20,0,i want all the $$,7,1,No,,,,,Male,30,Coll,"$35,001-$50,000",Yes,6000,3,3,3,yes
809,Republican,Trump,,7,7,Trump,,Yes,No,No,,,No,No,0,121,100,,,121,100,,7,7,Yes,Rep,,,,No,No,No,No,0,121,100,,,121,100,40,40,40,40,To be fair to the other person,6,1,No,,,,,Female,40,HS,"$10,001-$15,000",Yes,20,1,5,3,no
810,Democrat,Clinton,1,,1,,Sanders,Yes,,,No,No,No,No,0,,,4,1,4,1,6,,6,Yes,Dem,,No,No,,,No,No,0,,,56,50,56,50,40,0,20,0,I don't know this other person and I need to make money so I can pay my rent this month.,1,4,No,,,,,Female,39,Coll,"$10,001-$15,000",Yes,35000,3,5,3,yes
811,Republican,Trump,,5,5,Other,,No,No,Yes,,,No,Yes,1,24,14,,,24,14,,6,6,Yes,Rep,,,,No,No,No,No,0,56,50,,,56,50,40,0,20,0,"I feel given the same situation, the other will do the same. I don't know the other person and i think that is good reason enough to think of keeping the money to myself.",5,3,Yes,,,,,Male,48,Coll,"$50,001-$65,000",Yes,700,3,5,3,yes
812,Republican,Trump,,4,4,Trump,,No,No,No,,,No,No,0,27,18,,,27,18,,5,5,Yes,Other,,,,No,No,No,No,0,35,26,,,35,26,40,0,20,20,Wanted to be fair,4,1,No,,,,,Male,23,<Coll,"$25,001-$35,000",Yes,100104,3,3,3,yes
813,Democrat,Clinton,1,,1,,Sanders,No,,,No,No,No,No,0,,,-99,0,-99,0,1,,1,No,,No,No,No,,,No,No,0,,,-100,0,-100,0,40,0,20,0,I want all the monies!,1,2,No,,,,,Male,50,HS,"$35,001-$50,000",Yes,5,1,3,3,yes
814,Republican,Trump,,6,6,Other,,Yes,No,No,,,No,No,0,-48,0,,,-48,0,,6,6,Yes,Rep,,,,No,No,No,No,0,-48,0,,,-48,0,40,0,20,20,I made the decision so that both I and the other Mturk worker will receive the same amount of bonus.,7,1,No,,,,,Female,31,Coll,"$35,001-$50,000",Yes,40,1,4,3,yes
815,Democrat,Clinton,7,,7,,Sanders,Yes,,,No,No,No,No,0,,,125,100,125,100,7,,7,Yes,Dem,,No,No,,,No,No,0,,,125,100,125,100,40,0,20,20,It is equal for us to each receive $.20,1,7,No,,,,,Female,36,<Coll,"$50,001-$65,000",Yes,150-200,3,5,3,yes
816,Republican,Clinton,1,,1,Other,,No,,,No,No,No,No,0,,,10,4,10,4,,4,4,Yes,Rep,,,,No,No,No,No,0,29,20,,,29,20,40,0,20,20,"It doesn't really matter to me if a person is a Clinton supporter, even though I myself, am not one. I don't feel as though someone's political affiliations are a reason to not like them, so long as they are decent, reasonable people in their interactions with others. ",2,3,No,,,,,Male,31,Grad,"$10,001-$15,000",Yes,300,3,5,3,yes
817,Republican,Trump,,1,1,Other,,Yes,No,No,,,No,No,0,14,6,,,14,6,,5,5,Yes,Other,,,,No,No,No,No,0,38,28,,,38,28,,,,,,,,,,,,,,,,,,,,,3,no
818,Republican,Clinton,3,,3,Other,,No,,,No,No,No,No,0,,,30,20,30,20,,4,4,Yes,Rep,,,,No,No,No,No,0,46,38,,,46,38,40,0,20,0,I DECIDED TO DO WHAT I WOULD EXPECT EVERYONE TO DO. MAXIMIZE MY BONUS SEEMS LIKE THE RIGHT MOVE.,1,4,No,,,,,Female,57,Coll,"$65,001-$80,000",Yes,1000,2,4,3,yes
819,Republican,Trump,,7,7,Trump,,Yes,No,No,,,No,No,0,122,100,,,122,100,,5,5,Yes,Rep,,,,No,No,No,No,0,31,21,,,31,21,10,0,20,0,I need the money and I know if they had to make the decision more than likely they would do the same.,7,1,No,,,,,Female,45,<Coll,"$25,001-$35,000",Yes,5000,1,1,3,no
820,Democrat,Trump,,4,4,,Sanders,No,No,No,,,No,No,0,21,12,,,21,12,5,,5,Yes,Dem,,No,No,,,No,No,0,,,74,73,74,73,40,40,20,0,to have more money,3,1,No,,,,,Female,50,HS,"$35,001-$50,000",Yes,20000,1,5,3,no
821,Democrat,Clinton,6,,6,,Clinton,No,,,No,No,No,No,0,,,51,44,51,44,2,,2,Yes,Dem,,Yes,Yes,,,Yes,Yes,2,,,31,22,31,22,40,0,20,10,I wanted to transfer a little while keeping some.,1,7,No,,,,,Male,34,Coll,"$35,001-$50,000",Yes,6200,3,3,3,yes
822,Republican,Trump,,5,5,Other,,Yes,No,No,,,No,No,0,66,62,,,66,62,,6,6,Yes,Rep,,,,No,No,No,No,0,90,92,,,90,92,0,40,40,20,It's half,6,1,No,,,,,Female,37,Coll,"$65,001-$80,000",Yes,200,2,2,3,no
823,Republican,Trump,,2,2,Other,,No,No,No,,,No,No,0,23,14,,,23,14,,3,3,Yes,Other,,,,No,No,No,No,0,77,77,,,77,77,40,0,20,0,I wanted all of it,2,1,No,,,,,Male,31,Coll,"$35,001-$50,000",Yes,1000,2,1,3,yes
824,Democrat,Clinton,5,,5,,Sanders,Yes,,,No,No,No,No,0,,,36,26,36,26,5,,5,Yes,Other,,No,No,,,No,No,0,,,29,19,29,19,40,0,20,20,It is the most fair decision.  We will receive the same bonus.,1,5,No,,,,,Female,22,Coll,"$10,001-$15,000",Yes,175,3,4,3,yes
825,Democrat,Clinton,7,,7,,Clinton,Yes,,,No,No,No,No,0,,,71,68,71,68,6,,6,Yes,Dem,,No,No,,,No,No,0,,,72,70,72,70,40,40,20,0,I want the whole bonus.,1,7,No,,,,,Female,61,HS,"<$5,000",Yes,3000,3,4,3,no
826,Democrat,Clinton,6,,6,,Sanders,Yes,,,No,No,No,No,0,,,50,42,50,42,6,,6,Yes,Dem,,No,No,,,No,No,0,,,50,42,50,42,40,0,20,20,"I just wanted to be fair and considerate. If I have extra, I don't mind sharing.",1,6,No,,,,,Female,26,Grad,"$65,001-$80,000",Yes,630,3,4,3,yes
827,Republican,Trump,,5,5,Trump,,No,No,No,,,No,No,0,1,0,,,1,0,,4,4,No,,No,,,No,No,No,No,0,-10,0,,,-10,0,40,0,20,20,because I like to share but want to keep something for myself,5,1,No,,,,,Female,38,HS,"$35,001-$50,000",Yes,4,1,4,3,yes
828,Republican,Trump,,6,6,Other,,Yes,No,No,,,No,No,0,45,37,,,45,37,,5,5,Yes,Rep,,,,No,No,No,No,0,61,56,,,61,56,40,0,20,0,I chose to not transfer because I am seeking to maximize my personal benefit. I will not have a continuing interaction with the other and so there is no incentive to do otherwise. ,6,1,No,,,,,Male,29,Coll,"$10,001-$15,000",Yes,550,3,4,3,yes
829,Democrat,Clinton,7,,7,,Sanders,Yes,,,No,No,No,No,0,,,93,95,93,95,6,,6,Yes,Dem,,No,No,,,No,No,0,,,67,64,67,64,40,0,20,20,I wanted to be fair,1,7,No,,,,,Female,32,Coll,"<$5,000",Yes,1000,3,5,3,yes
830,Democrat,Trump,,3,3,,Sanders,No,No,No,,,No,No,0,0,0,,,0,0,1,,1,No,,Yes-Other,No,No,,,No,No,0,,,19,10,19,10,40,0,20,0,I support neither of the candidate (choose Trump because have to) and don't want to give my money to a Trump supporter. ,2,2,No,,,,,Female,23,Coll,"$15,001-$25,000",Yes,2300,4,4,3,yes
831,Republican,Trump,,5,5,Trump,,No,No,No,,,No,No,0,51,44,,,51,44,,4,4,Yes,Dem,,,,No,No,No,No,0,30,20,,,30,20,40,0,20,0,We all work for our own money,6,2,No,,,,,Female,29,HS,"<$5,000",Yes,2100,3,1,3,yes
832,Democrat,Clinton,7,,7,,Clinton,Yes,,,Yes,No,Yes,No,1,,,89,90,89,90,7,,7,Yes,Dem,,Yes,No,,,Yes,No,1,,,89,90,89,90,40,0,20,20,"I am sending them half of the bonus as I think that is fair. To me,. the bonus for the survey isn't something I should hold on to to benefit myself the most but something that should be distributed fairly to all participants. It's just luck if the other person doesn't get to chose the bonus, so I think it is not morally right for me to hold on to all of it and I should split it so both of us benefit equally.",1,7,No,,,,,Male,34,Grad,"$25,001-$35,000",Yes,1300,4,2,3,yes
833,Democrat,Trump,,1,1,,Sanders,No,No,No,,,No,No,0,-100,0,,,-100,0,1,,1,No,,No,No,No,,,No,No,0,,,-100,0,-100,0,40,0,20,20,"Everyone has their own personal views, but I think we should all treat all sentient beings the way we hope to be treated ourselves.  Thus, I split the bonus with a fellow sentient being.  There is no ""other.""",4,4,No,,,,,Female,49,<Coll,"$80,001-$100,000",Yes,1280,1,4,3,yes
834,Democrat,Clinton,3,,3,,Clinton,No,,,No,No,No,No,0,,,12,5,12,5,3,,3,No,,No,Yes,No,,,Yes,No,1,,,12,5,12,5,20,0,10,0,It just felt right at the time,2,4,No,,,,,Female,20,HS,"$10,001-$15,000",Yes,500,3,4,3,no
835,Democrat,Clinton,4,,4,,Sanders,Yes,,,No,No,No,No,0,,,29,20,29,20,3,,3,Yes,Other,,No,No,,,No,No,0,,,41,32,41,32,40,0,20,0, I do not know the other participant.  I cannot trust the other person to look out for my best interests. ,1,4,Yes,,,,,Male,33,Coll,"$35,001-$50,000",Yes,1000,2,5,3,yes
836,Republican,Trump,,7,7,Trump,,No,No,No,,,No,No,0,125,100,,,125,100,,4,4,No,,Yes-Other,,,No,No,No,No,0,-10,0,,,-10,0,40,40,20,40,I want to give them the most that I can.,5,1,No,,,,,Female,54,HS,"$25,001-$35,000",Yes,300,2,3,3,no
837,Republican,Trump,,7,7,Trump,,Yes,No,No,,,No,No,0,-40,0,,,-40,0,,6,6,Yes,Rep,,,,No,No,No,No,0,-45,0,,,-45,0,40,0,20,20,I made the decision to share $0.20 because I wanted both of us to receive a bonus.,7,1,No,,,,,Female,44,<Coll,"$15,001-$25,000",Yes,250,2,5,3,yes
838,Republican,Trump,,6,6,Trump,,Yes,No,No,,,No,No,0,85,86,,,85,86,,5,5,Yes,Rep,,,,No,No,No,No,0,56,50,,,56,50,40,0,20,20,I wanted to split evenly,6,1,No,,,,,Male,40,Grad,"$50,001-$65,000",Yes,5000,5,5,3,yes
839,Democrat,Clinton,7,,7,,Clinton,Yes,,,Yes,No,Yes,No,1,,,76,75,76,75,6,,6,Yes,Dem,,Yes,No,,,Yes,No,1,,,61,56,61,56,40,0,20,20,"I like this person, they support Hillary Clinton.  I don't mind sharing my bonus with them.",1,7,No,,,,,Male,29,Grad,"<$5,000",Yes,100,3,2,3,yes
840,Democrat,Clinton,7,,7,,Clinton,Yes,,,Yes,No,Yes,No,1,,,125,100,125,100,7,,7,Yes,Dem,,No,No,,,No,No,0,,,125,100,125,100,40,0,20,0,I don't think that there is another person.,1,7,Yes,,,,,Female,21,<Coll,"$15,001-$25,000",Yes,"1794	",2,1,3,yes
841,Republican,Trump,,6,6,Trump,,Yes,No,No,,,No,No,0,18,10,,,18,10,,3,3,Yes,Other,,,,No,No,No,No,0,19,10,,,19,10,40,0,20,20,I wanted the other person to receive the same amount of a bonus as I do.,5,1,No,,,,,Female,28,<Coll,"$50,001-$65,000",Yes,1000,4,5,3,yes
842,Democrat,Clinton,5,,5,,Clinton,No,,,No,No,No,No,0,,,21,12,21,12,5,,5,Yes,Other,,No,No,,,No,No,0,,,72,70,72,70,,,,,,,,,,,,,,,,,,,,,3,no
843,Democrat,Clinton,7,,7,,Clinton,Yes,,,No,No,No,No,0,,,62,57,62,57,6,,6,Yes,Dem,,No,No,,,No,No,0,,,19,10,19,10,40,0,20,20,I don't believe in taking advantage of other people.,1,6,No,,,,,Female,34,Grad,"$35,001-$50,000",Yes,250,4,5,3,yes
844,Democrat,Clinton,5,,5,,Clinton,Yes,,,No,No,No,No,0,,,-5,0,-5,0,5,,5,Yes,Dem,,No,No,,,No,No,0,,,37,28,37,28,40,0,20,0,Because I need the money.,1,1,Yes,,,,,Female,26,<Coll,"$10,001-$15,000",Yes,6900,1,1,3,yes
845,Democrat,Trump,,1,1,,Sanders,Yes,No,Yes,,,No,Yes,1,-1,0,,,-1,0,1,,1,Yes,Other,,No,No,,,No,No,0,,,-100,0,-100,0,40,0,20,0,I want to keep all of my money and no handouts to the other person.,5,1,Yes,,,,,Male,33,<Coll,"$35,001-$50,000",Yes,600,3,4,3,yes
846,Democrat,Trump,,1,1,,Sanders,No,No,No,,,No,No,0,3,1,,,3,1,1,,1,No,,No,No,No,,,No,No,0,,,10,4,10,4,40,0,20,20,because it was fair. ,3,2,No,,,,,Female,30,<HS,"$5,000-$10,000",Yes,5000,4,4,3,yes
847,Democrat,Clinton,5,,5,,Clinton,Yes,,,No,No,No,No,0,,,35,25,35,25,5,,5,Yes,Dem,,No,No,,,No,No,0,,,28,18,28,18,40,0,20,0,i wanted to maximise my bonus wit no regards to other participant,2,5,No,,,,,Male,42,Coll,">$100,000",Yes,5600,3,5,3,yes
848,Democrat,Clinton,2,,2,,Sanders,No,,,No,No,No,No,0,,,1,0,1,0,2,,2,Yes,Dem,,No,No,,,No,No,0,,,1,0,1,0,40,0,20,0,I decide to go with the transfer the maximize my bonus to do just that with no other motives.,4,5,No,,,,,Female,29,<Coll,"$15,001-$25,000",Yes,1000,3,4,3,yes
849,Democrat,Clinton,7,,7,,Clinton,Yes,,,No,No,No,No,0,,,50,42,50,42,4,,4,Yes,Dem,,No,No,,,No,No,0,,,18,10,18,10,40,0,20,20,its only fair we split it,1,7,Yes,,,,,Female,44,Coll,"$35,001-$50,000",Yes,1014 hits,3,5,3,yes
850,Democrat,Clinton,5,,5,,Sanders,Yes,,,No,No,No,No,0,,,24,15,24,15,4,,4,Yes,Other,,No,No,,,No,No,0,,,23,14,23,14,40,0,20,0,I don't feel they would donate as much as I would,1,5,No,,,,,Male,28,<Coll,"$25,001-$35,000",Yes,200,3,4,3,yes
851,Democrat,Clinton,7,,7,,Clinton,Yes,,,No,No,No,No,0,,,98,99,98,99,7,,7,Yes,Dem,,Yes,Yes,,,Yes,Yes,2,,,100,100,100,100,10,0,20,20,A 50/50 split. That's the fair way.,1,7,No,,,,,Female,29,Coll,"$35,001-$50,000",Yes,500,3,3,3,no
852,Democrat,Clinton,7,,7,,Clinton,No,,,Yes,No,Yes,No,1,,,122,100,122,100,7,,7,Yes,Dem,,Yes,No,,,Yes,No,1,,,127,100,127,100,40,40,40,25,Transfer money to another participant ,1,7,No,,,,,Female,30,Coll,"$50,001-$65,000",Yes,200,3,3,3,no
853,Democrat,Clinton,5,,5,,Sanders,No,,,No,No,No,No,0,,,84,85,84,85,6,,6,Yes,Dem,,No,No,,,No,No,0,,,78,78,78,78,40,0,20,10,I believe I need the money more than they do but don't want them to be empty handed and they share smilar values to me,1,6,No,,,,,Female,29,Coll,"$15,001-$25,000",Yes,20000,3,1,3,yes
854,Republican,Clinton,1,,1,Other,,No,,,No,No,No,No,0,,,-51,0,-51,0,,6,6,Yes,Rep,,,,No,No,No,No,0,75,74,,,75,74,40,0,20,0,I want the entire bonus,2,4,No,,,,,Male,31,Grad,">$100,000",Yes,25,1,3,3,yes
855,Republican,Trump,,1,1,Other,,No,No,No,,,No,No,0,-100,0,,,-100,0,,1,1,Yes,Other,,,,No,Yes,No,Yes,1,-50,0,,,-50,0,10,20,30,0,because.,2,1,No,,,,,Male,24,<Coll,"$5,000-$10,000",Yes,4000,1,1,3,no
856,Democrat,Clinton,4,,4,,Sanders,No,,,No,No,No,No,0,,,24,15,24,15,2,,2,Yes,Dem,,No,No,,,No,No,0,,,4,1,4,1,40,0,20,15,"I don't know that I have that much in common with the other person, and for whatever reason I didn't feel like splitting the bonus 50/50.",2,5,No,,,,,Female,29,Grad,"$35,001-$50,000",Yes,100,2,2,3,yes
857,Republican,Trump,,1,1,Trump,,Yes,No,No,,,No,No,0,5,1,,,5,1,,4,4,Yes,Rep,,,,No,No,No,No,0,19,11,,,19,11,40,0,20,0,I went with my gut feeling,4,1,No,,,,,Male,25,HS,"$25,001-$35,000",Yes,69,1,3,3,yes
858,Democrat,Clinton,1,,1,,Sanders,Yes,,,No,No,No,No,0,,,5,1,5,1,1,,1,Unable,,,No,No,,,No,No,0,,,16,8,16,8,40,0,20,20,Just figured i'd make it equal.,1,3,No,,,,,Female,25,<Coll,"$25,001-$35,000",Yes,500,1,1,3,yes
859,Democrat,Clinton,5,,5,,Sanders,No,,,No,Yes,No,Yes,1,,,50,43,50,43,5,,5,Yes,Dem,,No,Yes,,,No,Yes,1,,,56,50,56,50,40,0,20,0,"I do not know anything about the other person except he/she is a democrat supporting Clinton. I am doing this study for my interest and for money, so I acted in order to maximize my gain.",1,5,No,,,,,Male,32,Grad,"$50,001-$65,000",Yes,400,2,4,3,yes
860,Democrat,Clinton,5,,5,,Clinton,No,,,No,No,No,No,0,,,125,100,125,100,5,,5,Yes,Dem,,No,No,,,No,No,0,,,125,100,125,100,30,20,20,10,"to get better perspectives on the attitudes, etc.",4,6,No,,,,,Male,50,Grad,"$65,001-$80,000",Yes,20,1,3,3,no
861,Republican,Clinton,7,,7,Other,,No,,,No,No,No,No,0,,,2,0,2,0,,4,4,Yes,Rep,,,,No,No,No,No,0,60,55,,,60,55,30,20,30,30,because i felt like donating it. ,4,4,No,,,,,Female,33,Coll,"<$5,000",Yes,13,1,1,3,no
862,Democrat,Clinton,1,,1,,Sanders,No,,,No,No,No,No,0,,,-1,0,-1,0,2,,2,Unable,,,No,No,,,No,No,0,,,1,0,1,0,40,0,20,20,i value fairness. ,1,1,No,,,,,Male,31,<Coll,"$10,001-$15,000",Yes,a ubnch,3,5,3,yes
863,Republican,Clinton,5,,5,Other,,No,,,No,No,No,No,0,,,79,79,79,79,,3,3,Yes,Rep,,,,No,No,No,No,0,32,22,,,32,22,40,0,20,10,I feel that the other person would also want to keep more for themselves. It's confidential and you will never  know who decided what.,2,6,No,,,,,Female,39,<Coll,">$100,000",Yes,100,2,1,3,yes
864,Democrat,Trump,,5,5,,Sanders,No,No,No,,,No,No,0,40,31,,,40,31,2,,2,Yes,Other,,No,No,,,No,No,0,,,78,78,78,78,40,0,20,10,I wanted to donate something but I don't know the other person other than vague interest and I don't strongly support that candidate or party.,4,2,No,,,,,Male,31,HS,"$15,001-$25,000",Yes,4300,4,2,3,yes
865,Republican,Trump,,6,6,Other,,No,No,No,,,No,No,0,83,83,,,83,83,,6,6,Yes,Rep,,,,No,No,No,No,0,66,63,,,66,63,20,0,20,20,I like to share what I have with others . ,5,1,No,,,,,Female,55,<Coll,"$80,001-$100,000",Yes,3000,4,4,3,no
866,Republican,Trump,,3,3,Other,,No,No,No,,,No,No,0,-23,0,,,-23,0,,4,4,Yes,Rep,,,,No,No,No,No,0,-4,0,,,-4,0,40,0,20,10,"I don't really know. I guess because I always divide it equally, but it seems like whenever I'm the person on the receiving end I get nothing or close to it, so I decided to keep a little extra this time.",3,1,No,,,,,Female,43,<Coll,"$15,001-$25,000",Yes,176477,3,4,3,yes
867,Democrat,Clinton,3,,3,,Sanders,Yes,,,No,No,No,No,0,,,-3,0,-3,0,3,,3,Yes,Other,,No,No,,,No,No,0,,,-1,0,-1,0,40,0,20,0,I wanted the more bonus to myself.,2,3,No,,,,,Male,22,<Coll,"<$5,000",Yes,600,2,2,3,yes
868,Republican,Trump,,7,7,Trump,,Yes,No,No,,,No,No,0,8,3,,,8,3,,6,6,Yes,Other,,,,No,No,No,No,0,3,1,,,3,1,40,0,20,20,I chose to give us both an equal amount simply because it is the fair and generous thing to do.,7,1,No,,,,,Female,32,<Coll,"<$5,000",Yes,800,3,4,3,yes
869,Democrat,Clinton,1,,1,,Sanders,Yes,,,No,No,No,No,0,,,-100,0,-100,0,1,,1,Yes,Dem,,No,No,,,No,No,0,,,-20,0,-20,0,40,0,20,0,We have five children and I could really use the bonus right now. I do feel bad for not sharing it with the other player as I usually do when given the choice. ,1,1,No,,,,,Female,35,<Coll,"$35,001-$50,000",Yes,500,3,2,3,yes
870,Republican,Trump,,5,5,Other,,No,No,No,,,No,No,0,74,73,,,74,73,,5,5,Yes,Rep,,,,No,No,No,No,0,90,92,,,90,92,40,0,20,0,I wanted to maximize my bonus amount,7,1,No,,,,,Female,32,HS,"$35,001-$50,000",Yes,1000,3,2,3,yes
871,Democrat,Clinton,7,,7,,Sanders,No,,,Yes,No,Yes,No,1,,,85,86,85,86,6,,6,Yes,Other,,No,No,,,No,No,0,,,53,46,53,46,40,0,20,20,"The other person seems an agreeable sort, so it seemed reasonable to split the money fairly between us.",1,7,No,,,,,Male,34,<Coll,"$15,001-$25,000",Yes,300,3,1,3,yes
872,Democrat,Trump,,1,1,,Sanders,No,No,No,,,No,No,0,-100,0,,,-100,0,3,,3,Yes,Dem,,No,No,,,No,No,0,,,-25,0,-25,0,40,0,20,0,I wanted to keep the whole bonus.,2,2,No,,,,,Female,44,Coll,"<$5,000",Yes,100,2,5,3,yes
873,Democrat,Clinton,3,,3,,Sanders,Yes,,,No,No,No,No,0,,,-100,0,-100,0,4,,4,Yes,Other,,Yes,No,,,Yes,No,1,,,6,2,6,2,40,0,20,20,to be fair,1,4,Yes,,,,,Female,64,Coll,"$25,001-$35,000",Yes,108,2,5,3,yes
874,Republican,Trump,,3,3,Other,,No,No,No,,,No,No,0,-58,0,,,-58,0,,2,2,Yes,Rep,,,,No,Yes,No,Yes,1,33,24,,,33,24,40,0,20,0,"I'm broke. I have a chronic illness, and every tiny penny counts. ",2,1,No,,,,,Female,48,Coll,"$80,001-$100,000",Yes,1000,2,3,3,yes
875,Democrat,Clinton,7,,7,,Clinton,Yes,,,Yes,No,Yes,No,1,,,75,74,75,74,7,,7,Yes,Dem,,Yes,No,,,Yes,No,1,,,79,79,79,79,40,0,20,0,I'm doing surveys for $0.70. I'll keep the bonus. I'm broke. ,4,7,Yes,,,,,Male,24,Coll,"$50,001-$65,000",Yes,1000,5,5,3,yes
876,Democrat,Trump,,1,1,,Sanders,No,No,No,,,No,No,0,-100,0,,,-100,0,2,,2,Yes,Dem,,No,No,,,No,No,0,,,-8,0,-8,0,,,,,,,,,,,,,,,,,,,,,3,no
877,Democrat,Clinton,7,,7,,Clinton,Yes,,,No,Yes,No,Yes,1,,,79,79,79,79,6,,6,Yes,Dem,,Yes,No,,,Yes,No,1,,,83,84,83,84,40,0,20,20,logical,1,7,No,,,,,Female,34,<Coll,"$80,001-$100,000",Yes,2026,2,2,3,yes
878,Democrat,Trump,,4,4,,Sanders,Yes,No,No,,,No,No,0,38,28,,,38,28,5,,5,Yes,Dem,,No,No,,,No,No,0,,,66,62,66,62,40,0,20,20,I wanted to be fair for both of us.,4,2,Yes,,,,,Male,41,Coll,"$25,001-$35,000",Yes,1000,3,5,3,yes
879,Democrat,Clinton,5,,5,,Clinton,No,,,No,No,No,No,0,,,39,30,39,30,5,,5,Yes,Dem,,No,No,,,No,No,0,,,35,25,35,25,40,0,20,0,"I feel everyone gets what they work for. I am doing this study, therefore I deserve the bonus. Even though the other person has my same beliefs, that does not entitle them to a bonus. ",3,5,No,,,,,Female,43,<Coll,"$25,001-$35,000",Yes,200,3,2,3,yes
880,Democrat,Clinton,4,,4,,Sanders,Yes,,,No,Yes,No,Yes,1,,,9,4,9,4,5,,5,Yes,Dem,,No,No,,,No,No,0,,,18,9,18,9,40,0,20,0,Because I believe the other person will do the same thing.,1,4,No,,,,,Male,38,<Coll,"$50,001-$65,000",Yes,400,3,3,3,yes
881,Republican,Trump,,7,7,Other,,Yes,No,No,,,No,No,0,25,15,,,25,15,,6,6,Yes,Rep,,,,No,No,No,No,0,46,38,,,46,38,40,40,40,40,,,,,,,,,,,,,,,,,3,no
882,Republican,Trump,,7,7,Trump,,Yes,No,No,,,No,No,0,95,97,,,95,97,,7,7,Yes,Other,,,,Yes,Yes,Yes,Yes,2,79,79,,,79,79,40,0,20,20,Split the bonus. Fair is fair.,7,1,No,,,,,Male,45,Coll,"$10,001-$15,000",Yes,5000,4,5,3,yes
883,Democrat,Clinton,7,,7,,Clinton,Yes,,,No,No,No,No,0,,,125,100,125,100,7,,7,Yes,Dem,,Yes,Yes,,,Yes,Yes,2,,,125,100,125,100,40,40,40,20,Splitting the difference in case they do not transfer anything. It seems fair to go in the middle.,1,7,No,,,,,Female,55,<Coll,"$25,001-$35,000",Yes,100,4,5,3,no
884,Democrat,Trump,,1,1,,Sanders,No,No,No,,,No,No,0,-46,0,,,-46,0,1,,1,Yes,Dem,,No,No,,,No,No,0,,,-21,0,-21,0,40,0,0,0,"Since the best possible outcome with the highest chance of receiving the bonus is to keep all of it, that is the decision i choose",1,1,No,,,,,Female,36,Coll,"$35,001-$50,000",Yes,1600,1,4,3,no
885,Democrat,Clinton,1,,1,,Sanders,No,,,No,No,No,No,0,,,-100,0,-100,0,1,,1,Yes,Other,,No,No,,,No,No,0,,,-100,0,-100,0,40,0,20,0,"I took this transfer as a donation to his/her candidate, Hillary Clinton. My not donating was my way of protesting Hillary Clinton as President. Your choices at the beginning of the survey forced me to choose Clinton or Trump. I don't want either one as my President.",1,1,No,,,,,Male,64,<Coll,"$65,001-$80,000",Yes,2925,3,1,3,yes
886,Democrat,Clinton,2,,2,,Sanders,Yes,,,No,No,No,No,0,,,14,6,14,6,4,,4,Yes,Dem,,Yes,No,,,Yes,No,1,,,45,37,45,37,40,0,20,5,Skim a little off the top like Hillary does.,3,4,No,,,,,Male,30,Coll,"$35,001-$50,000",Yes,25000,3,2,3,yes
887,Democrat,Clinton,5,,5,,Clinton,Yes,,,No,No,No,No,0,,,54,48,54,48,5,,5,Yes,Dem,,No,No,,,No,No,0,,,48,40,48,40,40,0,20,20,It was only fair to split the money.,1,7,Yes,,,,,Male,28,Coll,"$25,001-$35,000",Yes,15000,3,3,3,yes
888,Republican,Trump,,3,3,Other,,No,No,No,,,No,No,0,11,4,,,11,4,,1,1,Yes,Other,,,,No,No,No,No,0,4,1,,,4,1,40,0,20,20,maximize both,2,1,No,,,,,Male,45,Grad,">$100,000",Yes,~100,4,4,3,yes
889,Democrat,Clinton,4,,4,,Sanders,Yes,,,No,No,No,No,0,,,17,9,17,9,4,,4,Yes,Dem,,No,No,,,No,No,0,,,51,44,51,44,40,0,20,20,It's just fair is all. ,1,4,No,,,,,Male,38,<Coll,"$50,001-$65,000",Yes,700,2,5,3,yes
890,Democrat,Trump,,1,1,,Sanders,Yes,No,No,,,No,No,0,-25,0,,,-25,0,3,,3,Yes,Dem,,No,No,,,No,No,0,,,12,5,12,5,40,0,20,0,i just made the decision that left me with more money,3,2,No,,,,,Male,21,<Coll,"<$5,000",Yes,500,2,2,3,yes
891,Republican,Trump,,5,5,Trump,,Yes,No,No,,,No,No,0,28,18,,,28,18,,5,5,Yes,Rep,,,,No,Yes,No,Yes,1,73,72,,,73,72,40,0,20,40,"I don't really have much invested, and 40 cents doesn't seem too much to give to someone.",7,1,No,,,,,Female,25,<Coll,"$10,001-$15,000",Yes,400,1,1,3,yes
892,Democrat,Clinton,5,,5,,Clinton,Yes,,,No,No,No,No,0,,,1,0,1,0,3,,3,Yes,Other,,No,No,,,No,No,0,,,13,6,13,6,40,0,20,0,"I have been deceived by these studies before. I do not actually know if there is another real person, so I choose to keep the entire bonus for myself.",1,5,No,,,,,Female,33,<Coll,"$65,001-$80,000",Yes,5000,3,1,3,yes
893,Republican,Trump,,7,7,Other,,No,Yes,No,,,Yes,No,1,75,74,,,75,74,,6,6,Yes,Other,,,,No,No,No,No,0,56,50,,,56,50,40,0,20,25,felt generous and respected the person because of their likeminded views,7,1,No,,,,,Female,30,Coll,"$50,001-$65,000",Yes,110,2,1,3,yes
894,Democrat,Clinton,1,,1,,Sanders,Yes,,,No,Yes,No,Yes,1,,,-56,0,-56,0,1,,1,Yes,Other,,No,No,,,No,No,0,,,-21,0,-21,0,40,0,20,20,Because I thought it was the most fair to both of us. ,1,1,No,,,,,Male,32,<Coll,"$25,001-$35,000",Yes,1400,3,1,3,yes
895,Republican,Trump,,7,7,Trump,,No,No,No,,,No,No,0,125,100,,,125,100,,6,6,Yes,Other,,,,No,No,No,No,0,125,100,,,125,100,40,0,20,10,"I wanted to give a little of what i Have, but not all of it so that I can prosper out of the bonus.",7,1,No,,,,,Male,31,<Coll,"$65,001-$80,000",Yes,5,1,5,3,yes
