SID,P_Pref,C_Pref ,Cl_Support,Tr_Support,Cand_Support,Rep_Prim,Dem_Prim,PrimElect,Tr_Dona,Tr_Volu,Cl_Dona,Cl_Volu,Cand_Dona,Cand_Volu,prev_candSupport,Tr_Difi_Dist,Tr_Difi_Over,Cl_Difi_Dist,Cl_Difi_Over,Cand_Difi_Dist,Cand_Difi_Overlap,Dem_Iden,Rep_Iden,Party_Iden,Regi,Reg_Party,Reg_Party_Plan,Dem_Dona,Dem_Volu,Rep_Dona,Rep_Volu,Party_Dona,Party_Volu,prev_partySupport,Rep_Difi_Dist,Rep_Difi_Over,Dem_Difi_Dist,Dem_Difi_Over,Party_Difi_Dist,Party_Difi_Over,DG_Test1,DG_Test2,DG_Test3,DG_Choice,Expl,Tr_Happy,Cl_Happy,EarlyVote,candVote_Choice,ClintonSupporter_Happy,TrumpSupporter_Happy,OtherSupporter_Happy,Gender,Age,Education,Income,USCit,Surveys,SimSurv,Scept,Wave,DG_In
2307,Republican,Trump,,1,1,Other,,Yes,No,No,,,No,No,0,-49,0,,,-49,0,,4,4,Yes,Dem,,,,No,No,No,No,0,-49,0,,,-49,0,,,,,,,,,,,,,,,,,,,,,8,no
2308,Democrat,Clinton,2,,2,,Sanders,Yes,,,No,No,No,No,0,,,-100,0,-100,0,4,,4,Yes,Other,,No,No,,,No,No,0,,,0,0,0,0,40,40,40,20,half to be fair,,4,No,,1,,1,Male,42,<Coll,"$65,001-$80,000",Yes,4000,1,2,8,no
2309,Democrat,Clinton,5,,5,,Clinton,No,,,No,No,No,No,0,,,48,40,48,40,5,,5,Yes,Other,,No,No,,,No,No,0,,,65,61,65,61,40,0,0,0,I feel like I'm gambling and I don't gamble because the chance of losing my money is not ok with me. ,,3,Yes,Clinton,1,,1,Male,34,Grad,"$50,001-$65,000",Yes,30,1,3,8,no
2310,Democrat,Clinton,7,,7,,Sanders,Yes,,,No,No,No,No,0,,,118,100,118,100,6,,6,Yes,Dem,,No,No,,,No,No,0,,,119,100,119,100,40,0,20,0,i wanted the max bonus,,1,Yes,Clinton,1,,1,Female,26,<Coll,"<$5,000",Yes,500,4,4,8,yes
2311,Democrat,Clinton,4,,4,,Sanders,Yes,,,No,No,No,No,0,,,39,30,39,30,3,,3,Yes,Dem,,No,No,,,No,No,0,,,28,19,28,19,40,0,20,20,It was the fair thing to do.,,3,Yes,Clinton,2,,2,Female,33,Coll,"$35,001-$50,000",Yes,200,3,2,8,yes
2312,Democrat,Clinton,5,,5,,Clinton,Yes,,,No,No,No,No,0,,,30,21,30,21,4,,4,Yes,Dem,,No,No,,,No,No,0,,,36,26,36,26,40,0,20,15,"I am doing the foot work, so I choose to give a portion of my earning to the fellow Turk.",,4,Yes,Clinton,2,,2,Female,37,<Coll,"$80,001-$100,000",Yes,20+,2,4,8,yes
2313,Democrat,Clinton,5,,5,,Clinton,Yes,,,No,No,No,No,0,,,36,26,36,26,7,,7,Yes,Dem,,No,No,,,No,No,0,,,122,100,122,100,40,0,20,0,wanted the full bonus,,1,Yes,Clinton,1,,1,Male,57,Coll,"$15,001-$25,000",Yes,2000,4,5,8,yes
2314,Democrat,Clinton,7,,7,,Clinton,No,,,No,No,No,No,0,,,93,95,93,95,6,,6,Yes,Dem,,No,No,,,No,No,0,,,69,67,69,67,40,0,20,20,"I think it's a fair amount. I wouldn't want to give the other person nothing, but I also wouldn't want to give away everything.",,1,Yes,Clinton,1,,1,Female,35,Coll,"$65,001-$80,000",Yes,100,4,3,8,yes
2315,Democrat,Clinton,1,,1,,Sanders,Yes,,,No,No,No,No,0,,,-11,0,-11,0,1,,1,Yes,Other,,No,No,,,No,No,0,,,3,1,3,1,20,20,40,20,I like everybody to have equally share ,,4,Yes,Other,1,,1,Female,31,<Coll,"$35,001-$50,000",Yes,365,3,5,8,no
2316,Republican,Trump,,2,2,Other,,Yes,No,No,,,No,No,0,26,16,,,26,16,,3,3,Yes,Rep,,,,No,No,No,No,0,36,27,,,36,27,40,0,20,20,"We both have equal stakes in this HIT, it has nothing to do with political preference.  Splitting the bonus is most fair.",4,,Yes,Other,,6,6,Male,32,Coll,">$100,000",Yes,900,4,4,8,yes
2317,Democrat,Clinton,3,,3,,Sanders,Yes,,,No,No,No,No,0,,,44,35,44,35,4,,4,Yes,Other,,No,No,,,No,No,0,,,37,28,37,28,40,0,20,0,"It has nothing to do with the other person. My finances are in bad shape, otherwise I wouldn't be sitting here taking surveys on Mturk. I honestly need whatever I can earn to care for my family. I'd have done the same no matter if it was Hillary or Trump.",,2,Yes,Other,1,,1,Male,34,Voc,"$50,001-$65,000",Yes,4000,4,1,8,yes
2318,Democrat,Clinton,7,,7,,Clinton,No,,,No,No,No,No,0,,,79,79,79,79,7,,7,Yes,Dem,,No,No,,,No,No,0,,,76,75,76,75,40,0,20,0,"I need the money, otherwise I would have sent it to them",,1,Yes,Clinton,1,,1,Female,26,HS,"$65,001-$80,000",Yes,2500,1,5,8,yes
2319,Democrat,Trump,,4,4,,Sanders,No,No,No,,,No,No,0,60,55,,,60,55,4,,4,Yes,Dem,,No,No,,,No,No,0,,,74,72,74,72,40,40,40,20,"Regardless of what party the other person is affiliated with, I chose to share the money.",,6,Yes,Other,,6,6,Female,59,HS,"$5,000-$10,000",Yes,"not sure, but I estimate 100",2,4,8,no
2320,Democrat,Clinton,5,,5,,Clinton,No,,,No,No,No,No,0,,,37,28,37,28,5,,5,Yes,Other,,No,No,,,No,No,0,,,58,53,58,53,40,0,20,20,I would have given the other person 50% regardless of what their party was because neither of us deserve more bonus than each other.,,4,Yes,Clinton,2,,2,Male,24,Grad,"$35,001-$50,000",Yes,465,3,5,8,yes
2321,Republican,Trump,,5,5,Other,,No,No,No,,,No,No,0,52,45,,,52,45,,6,6,No,,,,,No,No,No,No,0,93,95,,,93,95,40,0,20,0,"i want to maximize my bonus.we are talking about only 40 cents here. If we were talking about something that was a necessity to survive and i had a surplus then i would have shared more. but for only 40 cents i choose to keep all of it for myself.",6,,Yes,Other,,7,7,Male,37,Coll,">$100,000",Yes,20,4,2,8,yes
2322,Democrat,Clinton,3,,3,,Sanders,No,,,No,No,No,No,0,,,30,20,30,20,3,,3,Yes,Other,,No,No,,,No,No,0,,,16,8,16,8,40,0,20,20,"I would have split the earnings 50/50  either way, despite political orientation. They might have some use for the twenty extra cents and it won't hurt me in the long run.",,3,Yes,Other,2,,2,Male,19,<Coll,"$25,001-$35,000",Yes,2100,4,4,8,yes
2323,Democrat,Clinton,7,,7,,Sanders,Yes,,,No,No,No,No,0,,,79,79,79,79,7,,7,Yes,Dem,,Yes,No,,,Yes,No,1,,,98,99,98,99,40,0,20,20,We are both working hard to make money and I don't want to take away from them.,,1,Yes,Clinton,1,,1,Female,28,Coll,"$25,001-$35,000",Yes,around 15,1,5,8,yes
2324,Democrat,Trump,,1,1,,Sanders,Yes,No,No,,,No,No,0,-72,0,,,-72,0,4,,4,Yes,Other,,Yes,No,,,Yes,No,1,,,28,18,28,18,40,0,20,20,I made the decision to be fair.,,7,Yes,Other,,7,7,Female,29,Coll,"$25,001-$35,000",Yes,500,3,1,8,yes
2325,Democrat,Clinton,6,,6,,Sanders,Yes,,,No,No,No,No,0,,,72,70,72,70,7,,7,Yes,Dem,,No,No,,,No,No,0,,,80,80,80,80,40,0,20,0,I need the money homie,,3,Yes,Clinton,1,,1,Male,18,<Coll,"<$5,000",Yes,200,4,1,8,yes
2326,Democrat,Clinton,7,,7,,Sanders,Yes,,,No,No,No,No,0,,,75,74,75,74,7,,7,Yes,Dem,,Yes,Yes,,,Yes,Yes,2,,,105,100,105,100,40,0,20,20,"It was money I was not expecting as payment for my effort and I felt that it should be shared with others.  Because the other person believes similarly to me, I felt generous and shared half.",,2,Yes,Clinton,1,,1,Male,39,Grad,"$65,001-$80,000",Yes,1000,3,5,8,yes
2327,Democrat,Clinton,6,,6,,Sanders,Yes,,,No,No,No,No,0,,,-50,0,-50,0,7,,7,Yes,Dem,,No,Yes,,,No,Yes,1,,,-50,0,-50,0,40,0,20,0,Need the money,,1,Yes,Clinton,1,,1,Female,26,Coll,"$25,001-$35,000",Yes,1000,2,1,8,yes
2328,Republican,Trump,,7,7,Trump,,Yes,No,No,,,No,No,0,68,65,,,68,65,,7,7,Yes,Rep,,,,Yes,No,Yes,No,1,47,39,,,47,39,20,20,20,20,I believe that half is fair for both parties,7,,Yes,Trump,,7,7,Female,33,Coll,"$80,001-$100,000",Yes,800,2,5,8,no
2329,Democrat,Trump,,1,1,,Clinton,No,No,No,,,No,No,0,-100,0,,,-100,0,6,,6,Yes,Rep,,No,No,,,No,No,0,,,50,42,50,42,40,0,20,20,Seemed fair,,2,Yes,Other,,7,7,Female,34,<Coll,">$100,000",Yes,Too many to count,3,2,8,yes
2330,Democrat,Clinton,7,,7,,Sanders,No,,,No,No,No,No,0,,,-22,0,-22,0,7,,7,Yes,Dem,,No,No,,,No,No,0,,,-5,0,-5,0,40,40,0,0,we can help each many ways. If the objective is to maintain max bonus for both we can either transfer the max we can to each other or take nothing from each other as well.  ,,1,No,,1,,1,Male,25,Coll,"$25,001-$35,000",Yes,this is the first one,1,5,8,no
2331,Republican,Trump,,7,7,Trump,,Yes,No,No,,,No,No,0,81,82,,,81,82,,7,7,Yes,Rep,,,,No,Yes,No,Yes,1,121,100,,,121,100,40,0,20,0,I needed the money ,7,,Yes,Trump,,7,7,Male,25,<Coll,"$5,000-$10,000",Yes,100,1,4,8,yes
2332,Democrat,Clinton,4,,4,,Sanders,Yes,,,No,Yes,No,Yes,1,,,17,9,17,9,3,,3,Yes,Dem,,No,Yes,,,No,Yes,1,,,22,13,22,13,40,0,20,0,n/a,,4,Yes,Clinton,2,,2,Female,24,<Coll,"$25,001-$35,000",Yes,100,2,4,8,yes
2333,Republican,Trump,,7,7,Other,,Yes,No,No,,,No,No,0,125,100,,,125,100,,5,5,Yes,Rep,,,,No,No,No,No,0,60,55,,,60,55,40,0,20,20,I wanted to be fair to my fellow trump supporter...,7,,Yes,Trump,,6,6,Male,23,HS,"$80,001-$100,000",Yes,1200,4,5,8,yes
2334,Democrat,Clinton,,,0,,,,,,,,0,0,2,,,,,0,0,5,,5,Yes,Dem,,No,No,,,No,No,0,,,31,21,31,21,,,,,,,,,,,,,,,,,,,,,8,no
2335,Democrat,Clinton,7,,7,,Clinton,Yes,,,No,No,No,No,0,,,125,100,125,100,7,,7,Yes,Dem,,No,Yes,,,No,Yes,1,,,125,100,125,100,20,0,40,20,fair,,1,Yes,Clinton,1,,1,Female,52,Grad,"$65,001-$80,000",Yes,1043,2,3,8,no
2336,Democrat,Clinton,7,,7,,Clinton,No,,,No,No,No,No,0,,,54,47,54,47,5,,5,Yes,Other,,No,No,,,No,No,0,,,61,56,61,56,40,0,20,20,"Since there was so little involve, we might as well share equally.",,2,Yes,Clinton,1,,1,Female,73,Grad,"$80,001-$100,000",Yes,100,1,5,8,yes
2337,Democrat,Clinton,5,,5,,Clinton,Yes,,,No,No,No,No,0,,,79,79,79,79,5,,5,Yes,Dem,,No,No,,,No,No,0,,,77,76,77,76,40,0,20,20,I think it is fair to split it because they voted the same as me,,3,Yes,Clinton,1,,1,Female,52,Grad,"$25,001-$35,000",Yes,755,3,3,8,yes
2338,Democrat,Clinton,5,,5,,Sanders,Yes,,,No,No,No,No,0,,,69,67,69,67,5,,5,Yes,Dem,,No,No,,,No,No,0,,,82,83,82,83,40,0,20,0,I could use the extra money for myself.,,1,Yes,Clinton,1,,1,Male,31,<Coll,"$25,001-$35,000",Yes,100,3,1,8,yes
2339,Republican,Trump,,7,7,Trump,,Yes,Yes,No,,,Yes,No,1,91,93,,,91,93,,5,5,Yes,Rep,,,,Yes,No,Yes,No,1,26,16,,,26,16,40,0,20,30,I just wanted to be nice and give the person something for their troubles. I'm already going to make 50 cents so I decided to give them some of my bonus earnings. I'd rather give than receive anyways. Looking back I should've given the person the full bonus.,7,,Yes,Trump,,7,7,Male,33,Voc,"$10,001-$15,000",Yes,137,3,5,8,yes
2340,Republican,Trump,,5,5,Other,,Yes,No,Yes,,,No,Yes,1,82,82,,,82,82,,5,5,Yes,Rep,,,,Yes,No,Yes,No,1,75,74,,,75,74,40,0,20,0,I would like to keep it all so I can donate it to a good cause,5,,Yes,Trump,,5,5,Male,35,Coll,"$50,001-$65,000",Yes,4000,3,4,8,yes
2341,Democrat,Clinton,3,,3,,Sanders,Yes,,,No,No,No,No,0,,,12,5,12,5,3,,3,Yes,Other,,No,Yes,,,No,Yes,1,,,28,18,28,18,40,0,20,20,It gives us an equal amount of money,,1,Yes,Clinton,1,,1,Other,24,Coll,"$5,000-$10,000",Yes,5000,4,5,8,yes
2342,Democrat,Clinton,2,,2,,Sanders,No,,,No,No,No,No,0,,,15,7,15,7,4,,4,No,,,No,No,,,No,No,0,,,44,35,44,35,40,0,20,20,I decided it was fair to split bonus in half.,,1,No,,1,,1,Male,24,HS,"$10,001-$15,000",Yes,200,3,3,8,yes
2343,Democrat,Clinton,5,,5,,Sanders,Yes,,,No,No,No,No,0,,,17,9,17,9,5,,5,Yes,Dem,,No,No,,,No,No,0,,,32,23,32,23,40,0,20,0,I want the money.,,2,Yes,Clinton,1,,1,Male,29,Grad,"$50,001-$65,000",Yes,7000,3,1,8,yes
2344,Democrat,Clinton,6,,6,,Clinton,Yes,,,No,No,No,No,0,,,76,75,76,75,6,,6,Yes,Dem,,No,No,,,No,No,0,,,44,36,44,36,40,0,20,0,"I wanted to keep the entire bonus for myself. Just because that person voted the same way I did in an election does not mean that I want to necessarily give them money. Maybe if I knew more about that person, I might be more inclined to give them money. I also don't fully believe that another person's bonus depends on my choice. All I may have been doing is lowering my own bonus.",,2,Yes,Clinton,2,,2,Male,25,Coll,"$65,001-$80,000",Yes,300,2,1,8,yes
2345,Democrat,Clinton,7,,7,,Sanders,Yes,,,No,No,No,No,0,,,84,85,84,85,7,,7,Yes,Dem,,No,No,,,No,No,0,,,93,95,93,95,0,40,20,20,It's half of my total,,1,Yes,Clinton,1,,1,Female,33,Grad,"<$5,000",Yes,2960,4,3,8,no
2346,Democrat,Clinton,1,,1,,Sanders,Yes,,,No,No,No,No,0,,,-50,0,-50,0,3,,3,Yes,Dem,,No,No,,,No,No,0,,,-50,0,-50,0,40,0,20,20,I usually share.,,4,Yes,Other,1,,1,Female,35,Coll,"<$5,000",Yes,900ish,3,1,8,yes
2347,Democrat,Clinton,6,,6,,Sanders,No,,,No,No,No,No,0,,,72,70,72,70,5,,5,Yes,Dem,,No,No,,,No,No,0,,,91,93,91,93,40,0,20,20,I thought it'd be fair for both of us to receive the same amount.,,3,Yes,Clinton,4,,4,Female,25,<Coll,"<$5,000",Yes,I don't know.,3,4,8,yes
2348,Republican,Trump,,7,7,Trump,,No,No,No,,,No,No,0,125,100,,,125,100,,7,7,Yes,Rep,,,,No,No,No,No,0,117,100,,,117,100,40,40,20,15,I made the decision to transfer some but not quite half of all the money as i was the one in control of the situation.  I figured i would at least give them something because they took part in the survey.  ,7,,Yes,Trump,,6,6,Male,23,Coll,"$25,001-$35,000",Yes,im not sure,3,2,8,no
2349,Democrat,Clinton,7,,7,,Clinton,Yes,,,No,No,No,No,0,,,56,50,56,50,5,,5,Yes,Dem,,No,No,,,No,No,0,,,35,25,35,25,40,0,20,20,I like to be fair and equitable. That's the result I would like for them to select if they were making the decision for me.,,1,Yes,Clinton,1,,1,Female,32,Coll,"$50,001-$65,000",Yes,1000,2,5,8,yes
2350,Republican,Trump,,7,7,Trump,,Yes,No,No,,,No,No,0,125,100,,,125,100,,7,7,Yes,Rep,,,,No,Yes,No,Yes,1,125,100,,,125,100,40,0,20,20,"If I transfer 20 cents to the other participant, we both get 20 cents extra. It is fair. Yes, I could have kept all the money for myself, but I'm in a good mood today and we share the same political views.",7,,Yes,Trump,,7,7,Male,20,<Coll,"$10,001-$15,000",Yes,50,1,5,8,yes
2351,Democrat,Clinton,5,,5,,Sanders,No,,,No,No,No,No,0,,,29,19,29,19,5,,5,Yes,Other,,No,No,,,No,No,0,,,34,25,34,25,40,0,20,20,Seems only fair to split evenly,,2,Yes,Clinton,1,,1,Male,33,Grad,"$65,001-$80,000",Yes,25,3,4,8,yes
2352,Democrat,Clinton,3,,3,,Sanders,Yes,,,No,No,No,No,0,,,-55,0,-55,0,4,,4,Yes,Dem,,No,No,,,No,No,0,,,4,1,4,1,40,0,20,20,I made the choice because I believe it was fair for everyone to benefit.,,4,Yes,Clinton,3,,3,Female,23,<Coll,"$25,001-$35,000",Yes,75,3,3,8,yes
2353,Democrat,Clinton,4,,4,,Sanders,Yes,,,No,No,No,No,0,,,29,20,29,20,4,,4,Yes,Dem,,No,No,,,No,No,0,,,65,61,65,61,40,0,20,0,i have never met the other person and felt no reason to split the bonus with them.,,2,Yes,Clinton,1,,1,Male,35,Coll,">$100,000",Yes,500,3,2,8,yes
2354,Republican,Trump,,1,1,Other,,Yes,Yes,No,,,Yes,No,1,-41,0,,,-41,0,,2,2,Yes,Other,,,,No,No,No,No,0,-3,0,,,-3,0,30,30,20,20,"might as well be fair, it's not their fault they support Trump.  I'm sure I am in the minority in this greedy, selfish society we're becoming",1,,Yes,Other,,6,6,Female,49,<Coll,"$25,001-$35,000",Yes,2000,3,2,8,no
2355,Republican,Trump,,5,5,Other,,No,No,No,,,No,No,0,46,38,,,46,38,,5,5,Yes,Rep,,,,No,No,No,No,0,64,60,,,64,60,40,0,20,20,I wanted to be fair.,5,,Yes,Trump,,7,7,Female,54,<Coll,"$25,001-$35,000",Yes,575,1,5,8,yes
2356,Republican,Trump,,7,7,Trump,,Yes,Yes,No,,,Yes,No,1,84,85,,,84,85,,2,2,Yes,Rep,,,,No,No,No,No,0,31,22,,,31,22,40,0,20,20,I transferred it because I wanted to share with another human being. I didn't care if they were a Republican or not,7,,Yes,Trump,,7,7,Female,56,<Coll,"$25,001-$35,000",Yes,2800,4,5,8,yes
2357,Republican,Trump,,7,7,Trump,,Yes,No,No,,,No,No,0,125,100,,,125,100,,7,7,Yes,Rep,,,,No,No,No,No,0,112,100,,,112,100,40,0,0,40,just gut instinct,7,,Yes,Trump,,7,7,Female,55,Voc,"$25,001-$35,000",Yes,7000,3,5,8,no
2358,Democrat,Trump,,4,4,,Sanders,Yes,No,No,,,No,No,0,18,10,,,18,10,3,,3,Yes,Dem,,No,No,,,No,No,0,,,21,12,21,12,40,0,20,10,"I just picked one, so at least both of us got some money",,1,No,,,6,6,Female,26,HS,"<$5,000",Yes,1500,3,2,8,yes
2359,Democrat,Clinton,1,,1,,Sanders,No,,,No,Yes,No,Yes,1,,,38,28,38,28,4,,4,Yes,Other,,Yes,Yes,,,Yes,Yes,2,,,53,46,53,46,40,0,20,0,"I preferred to keep the money, regardless of political leaning.",,4,Yes,Other,1,,1,Male,34,Grad,"$5,000-$10,000",Yes,200,3,1,8,yes
2360,Republican,Trump,,7,7,Trump,,Yes,No,No,,,No,No,0,123,100,,,123,100,,4,4,Yes,Other,,,,Yes,Yes,Yes,Yes,2,30,21,,,30,21,30,20,20,35,I did a moral and right thing,7,,Yes,Trump,,7,7,Male,44,<Coll,"$10,001-$15,000",Yes,10,1,5,8,no
2361,Democrat,Clinton,1,,1,,Sanders,Yes,,,No,No,No,No,0,,,-48,0,-48,0,7,,7,Yes,Dem,,No,No,,,No,No,0,,,0,0,0,0,40,0,20,0,"I don't know the person and I feel no ties or relationship with that person. Also, 40 cents shared between me and this person is not a huge monetary value, so I thought I might as well just keep the whole thing for myself.",,2,No,,1,,1,Female,24,<Coll,"<$5,000",Yes,400,4,4,8,yes
2362,Republican,Trump,,5,5,Trump,,Yes,No,No,,,No,No,0,46,38,,,46,38,,3,3,Yes,Other,,,,No,No,No,No,0,45,36,,,45,36,20,20,20,20,50/50,5,,Yes,Trump,,7,7,Male,32,Voc,"$35,001-$50,000",Yes,50,1,4,8,no
2363,Democrat,Clinton,5,,5,,Sanders,No,,,No,Yes,No,Yes,1,,,45,36,45,36,5,,5,Yes,Other,,No,No,,,No,No,0,,,79,79,79,79,40,0,20,20,So we both benefit.,,2,Yes,Clinton,1,,1,Female,34,Grad,"$35,001-$50,000",Yes,641,2,1,8,yes
2364,Republican,Trump,,6,6,Trump,,Yes,No,No,,,No,No,0,46,38,,,46,38,,4,4,Yes,Dem,,,,No,No,No,No,0,48,40,,,48,40,40,40,20,20,I thought transferring  20 cents was fair because I really didn't know much about the other person so 20 was fair half of 40 cents.,7,,Yes,Trump,,7,7,Female,60,HS,"$15,001-$25,000",Yes,294,1,5,8,no
2365,Democrat,Clinton,5,,5,,Sanders,No,,,No,No,No,No,0,,,41,32,41,32,4,,4,Yes,Dem,,No,No,,,No,No,0,,,35,25,35,25,40,0,20,0,I wanted all of that bonus,,1,Yes,Clinton,1,,1,Male,31,Grad,">$100,000",Yes,15500,1,1,8,yes
2366,Democrat,Clinton,5,,5,,Sanders,No,,,No,No,No,No,0,,,35,26,35,26,6,,6,Yes,Other,,No,No,,,No,No,0,,,54,47,54,47,40,0,20,20,It just seems fair to split the 40 cents.,,1,Yes,Clinton,1,,1,Female,51,Voc,"$15,001-$25,000",Yes,2560,3,3,8,yes
2367,Democrat,Trump,,5,5,,Sanders,No,No,No,,,No,No,0,30,20,,,30,20,2,,2,Yes,Dem,,No,No,,,No,No,0,,,15,7,15,7,40,0,20,0,I have bills to pay since I've been in the hospital and I decided to keep the whole bonus.,,6,Yes,Trump,,7,7,Male,42,Coll,"$35,001-$50,000",Yes,500,3,2,8,yes
2368,Republican,Trump,,5,5,Trump,,Yes,No,No,,,No,No,0,62,58,,,62,58,,5,5,Yes,Rep,,,,No,No,No,No,0,86,88,,,86,88,40,0,20,10,It just seemed fair to give him SOME.,6,,Yes,Trump,,7,7,Male,24,HS,"$5,000-$10,000",Yes,125-140,3,3,8,yes
2369,Democrat,Clinton,1,,1,,Sanders,Yes,,,No,No,No,No,0,,,8,3,8,3,5,,5,Yes,Other,,Yes,Yes,,,Yes,Yes,2,,,29,19,29,19,40,0,20,0,I need the bonus.,,3,Yes,Other,3,,3,Male,37,<Coll,"$35,001-$50,000",Yes,7000,3,3,8,yes
2370,Republican,Trump,,4,4,Other,,Yes,No,No,,,No,No,0,52,45,,,52,45,,5,5,Yes,Rep,,,,Yes,No,Yes,No,1,75,74,,,75,74,40,0,20,20,I was the fairest decision to both parties.,6,,Yes,Trump,,7,7,Male,54,Coll,"$25,001-$35,000",Yes,maybe a 100,3,2,8,yes
2371,Republican,Clinton,3,,3,Other,,Yes,,,No,No,No,No,0,,,3,1,3,1,,2,2,Yes,Rep,,,,No,No,No,No,0,4,1,,,4,1,40,0,20,0,"40 cents is a negligible amount. id rather just keep it all for myself. I will never meet this person and they will never know who i am. I did not consider the fact that they were a democrat, I would have done the same thing to a republican. ",2,,Yes,Clinton,1,,1,Female,23,Coll,"$50,001-$65,000",Yes,4000,4,3,8,yes
2372,Democrat,Clinton,4,,4,,Sanders,Yes,,,No,No,No,No,0,,,32,22,32,22,4,,4,Yes,Dem,,No,No,,,No,No,0,,,39,30,39,30,40,40,0,10,I decided to give them 10 out of the 40 cents because I wanted to be somewhat fair and not as greedy.,,2,Yes,Clinton,1,,1,Female,25,Coll,"$15,001-$25,000",Yes,1500,3,4,8,no
2373,Republican,Clinton,5,,5,Other,,Yes,,,No,No,No,No,0,,,32,23,32,23,,5,5,Yes,Other,,,,No,Yes,No,Yes,1,66,63,,,66,63,40,40,20,40,hoping for the best outcome,4,,Yes,Trump,2,,2,Female,55,<Coll,"$50,001-$65,000",Yes,1700,3,4,8,no
2374,Republican,Trump,,3,3,Trump,,Yes,No,No,,,No,No,0,3,1,,,3,1,,3,3,Yes,Other,,,,No,No,No,No,0,6,2,,,6,2,40,40,40,5,I'm working for nickel & dimes. Why should I transfer to the other person any money at all ?,4,,Yes,Trump,,6,6,Female,54,Coll,"$35,001-$50,000",Yes,65,2,4,8,no
2375,Democrat,Clinton,6,,6,,Sanders,No,,,No,No,No,No,0,,,42,33,42,33,6,,6,Yes,Dem,,No,No,,,No,No,0,,,48,40,48,40,20,20,20,40,I am feeling generous because it's Thanksgiving and I'm happy that someone else chooses to vote for Hillary. :),,1,Yes,Clinton,1,,1,Female,47,Coll,"$35,001-$50,000",Yes,10,3,5,8,no
2376,Republican,Trump,,4,4,Trump,,No,No,No,,,No,No,0,-100,0,,,-100,0,,2,2,Yes,Other,,,,No,No,No,No,0,-100,0,,,-100,0,40,0,40,0,Wasn't feeling very charitable and didn't feel like giving.,4,,Yes,Trump,,4,4,Female,58,Coll,"$65,001-$80,000",Yes,1788,5,5,8,no
2377,Democrat,Clinton,5,,5,,Sanders,No,,,No,No,No,No,0,,,-74,0,-74,0,1,,1,Yes,Other,,No,No,,,No,No,0,,,-98,0,-98,0,40,0,20,20,It's what I usually do for these things. ,,1,Yes,Clinton,1,,1,Female,35,<Coll,"$15,001-$25,000",Yes,1300,3,1,8,yes
2378,Republican,Trump,,3,3,Other,,Yes,No,No,,,No,No,0,65,61,,,65,61,,3,3,Yes,Other,,,,Yes,No,Yes,No,1,30,20,,,30,20,40,0,20,20,I feel like like being nice and sharing evenly in the study ,4,,Yes,Trump,,6,6,Male,48,Coll,">$100,000",Yes,262,1,1,8,yes
2379,Democrat,Clinton,2,,2,,Sanders,Yes,,,No,No,No,No,0,,,16,8,16,8,2,,2,Yes,Dem,,Yes,Yes,,,Yes,Yes,2,,,18,9,18,9,40,0,20,20,"I think it's fair that we both get the same amount of money. Even though I don't know them, 50/50 is generally a fair split, especially since it's bonus money that we normally wouldn't have received.",,3,Yes,Clinton,1,,1,Male,30,<Coll,"$15,001-$25,000",Yes,200,2,3,8,yes
2380,Democrat,Clinton,5,,5,,Sanders,Yes,,,No,No,No,No,0,,,35,26,35,26,4,,4,Yes,Dem,,No,No,,,No,No,0,,,25,15,25,15,40,0,20,20,"20 is the fair choice, this way we both get the same bonus.",,1,Yes,Clinton,1,,1,Male,24,Coll,"$65,001-$80,000",Yes,100,2,5,8,yes
2381,Democrat,Clinton,7,,7,,Clinton,Yes,,,Yes,No,Yes,No,1,,,65,61,65,61,7,,7,Yes,Dem,,Yes,No,,,Yes,No,1,,,57,51,57,51,40,0,20,25,"Because we both get a substantial bonus, but I'm showing my appreciation of their political stance with the extra 5 cents.",,1,Yes,Clinton,1,,1,Female,32,Grad,"$25,001-$35,000",Yes,232,2,5,8,yes
2382,Democrat,Clinton,6,,6,,Clinton,Yes,,,No,No,No,No,0,,,67,63,67,63,5,,5,Yes,Dem,,No,No,,,No,No,0,,,44,36,44,36,40,0,20,20,It seems like a 50/50 split is a fair way to decide on this.,,1,Yes,Clinton,1,,1,Male,32,Grad,">$100,000",Yes,136,1,5,8,yes
2383,Republican,Trump,,6,6,Trump,,Yes,No,No,,,No,No,0,83,83,,,83,83,,5,5,Yes,Rep,,,,No,No,No,No,0,69,66,,,69,66,40,0,20,0,I'm doing this HIT and work by myself therefore I want to keep the most bonus for myself. I hope any man would work hard and keep their wage or bonus. I won't blame them for keeping what they earn.,6,,Yes,Trump,,7,7,Male,43,Grad,"$35,001-$50,000",Yes,2121,4,4,8,yes
2384,Democrat,Clinton,1,,1,,Sanders,Yes,,,No,No,No,No,0,,,-30,0,-30,0,2,,2,Yes,Dem,,No,No,,,No,No,0,,,19,11,19,11,40,0,20,15,"At first I wanted to send the other worker 20 cents so it would be equal between us, but then at the last minute I decided I wanted to keep 5 more of those cents, just because I can. ",,1,Yes,Other,1,,1,Male,19,HS,"$25,001-$35,000",Yes,over 100,4,4,8,yes
2385,Democrat,Clinton,3,,3,,Sanders,Yes,,,No,No,No,No,0,,,59,54,59,54,3,,3,Yes,Dem,,Yes,No,,,Yes,No,1,,,56,50,56,50,40,0,20,20,to be equal,,1,Yes,Clinton,1,,1,Female,45,Coll,">$100,000",Yes,600,3,5,8,yes
2386,Republican,Trump,,6,6,Trump,,No,No,Yes,,,No,Yes,1,3,1,,,3,1,,6,6,No,,,,,No,No,No,No,0,55,48,,,55,48,40,0,20,20,fair is fair I am willing to share my good fortune with aconservative,7,,No,,,7,7,Male,73,Grad,"$35,001-$50,000",Yes,3100,3,2,8,yes
2387,Republican,Trump,,6,6,Trump,,No,No,No,,,No,No,0,125,100,,,125,100,,4,4,No,,,,,No,No,No,No,0,49,42,,,49,42,40,0,20,20,I want to be fair so I transferred half of the earnings ,4,,No,,,7,7,Female,29,HS,"$15,001-$25,000",Yes,160,1,4,8,yes
2388,Democrat,Clinton,4,,4,,Sanders,No,,,No,No,No,No,0,,,22,13,22,13,3,,3,Yes,Dem,,No,No,,,No,No,0,,,23,14,23,14,40,0,20,0,I want the money. I do not care about the other person,,3,Yes,Clinton,1,,1,Male,29,Coll,"$25,001-$35,000",Yes,70,1,4,8,yes
2389,Republican,Trump,,2,2,Other,,Yes,No,No,,,No,No,0,17,9,,,17,9,,5,5,Yes,Rep,,,,No,No,No,No,0,55,48,,,55,48,40,0,20,5,"Well, I want to maximize my benefit but a 5 cent bonus for him seemed nice.",4,,Yes,Other,,6,6,Male,26,Coll,"$35,001-$50,000",Yes,400,2,4,8,yes
2390,Republican,Trump,,4,4,Other,,No,No,No,,,No,No,0,21,12,,,21,12,,4,4,Yes,Rep,,,,No,No,No,No,0,24,15,,,24,15,40,0,20,15,I prob need the money slightly more than the average person. So that's hw I divided it,5,,Yes,Trump,,6,6,Female,53,Coll,"$15,001-$25,000",Yes,100,3,4,8,yes
2391,Republican,Trump,,4,4,Other,,No,No,No,,,No,No,0,24,15,,,24,15,,6,6,Yes,Rep,,,,No,No,No,No,0,71,68,,,71,68,40,0,20,0,I wanted to keep my bonus.,4,,Yes,Trump,,4,4,Female,22,<Coll,"$35,001-$50,000",Yes,20,1,3,8,yes
2392,Republican,Trump,,5,5,Trump,,No,No,No,,,No,No,0,125,100,,,125,100,,4,4,No,,,,,No,Yes,No,Yes,1,45,36,,,45,36,40,0,20,0,I need the money and this person will never know I took all of it.,7,,No,,,7,7,Female,25,HS,"$10,001-$15,000",Yes,200,1,1,8,yes
2393,Republican,Trump,,4,4,Trump,,No,No,No,,,No,No,0,59,53,,,59,53,,6,6,Yes,Rep,,,,No,No,No,No,0,65,61,,,65,61,40,0,20,20,I was trying to be fair. ,5,,No,,,7,7,Female,27,Coll,"$35,001-$50,000",Yes,400,3,5,8,yes
2394,Democrat,Clinton,5,,5,,Sanders,No,,,No,No,No,No,0,,,35,26,35,26,5,,5,Yes,Other,,Yes,No,,,Yes,No,1,,,53,46,53,46,40,40,20,20,I do not mind sharing something that is essentially a gift to me.,,2,Yes,Clinton,1,,1,Female,67,Grad,"$15,001-$25,000",Yes,1000+,3,3,8,no
2395,Democrat,Clinton,2,,2,,Sanders,No,,,No,No,No,No,0,,,18,9,18,9,5,,5,Yes,Dem,,No,No,,,No,No,0,,,101,100,101,100,40,0,20,5,"I didn't want to be greedy by keeping all of the money, so, I decided to give some of the money to the other participant.",,2,No,,1,,1,Female,25,<Coll,"$10,001-$15,000",Yes,"10,450",3,4,8,yes
2396,Democrat,Clinton,5,,5,,Sanders,Yes,,,No,Yes,No,Yes,1,,,85,86,85,86,5,,5,Yes,Dem,,No,Yes,,,No,Yes,1,,,125,100,125,100,30,20,30,25,I felt like i wanted to take a risk but not put evrything on it,,2,Yes,Clinton,1,,1,Male,25,Coll,"$50,001-$65,000",Yes,1000,3,4,8,no
2397,Democrat,Clinton,1,,1,,Sanders,Yes,,,No,No,No,No,0,,,28,18,28,18,4,,4,Yes,Dem,,Yes,Yes,,,Yes,Yes,2,,,43,35,43,35,40,0,20,0,I see no reason to sacrifice my bonus just so some stranger can have more.,,2,Yes,Other,1,,1,Male,43,Grad,">$100,000",Yes,400,5,5,8,yes
2398,Democrat,Clinton,3,,3,,Sanders,No,,,No,Yes,No,Yes,1,,,6,2,6,2,5,,5,Yes,Dem,,Yes,No,,,Yes,No,1,,,16,8,16,8,40,40,40,30,"I wanted to be fair and give a decent amount",,2,Yes,Clinton,2,,2,Female,25,<Coll,"$15,001-$25,000",Yes,465,3,1,8,no
